{
  "gameVersion": "S2 2.323[C]",
  "catalogVersion": "2.323",
  "scope": "nightmare-otherworld",
  "collectedOn": "2026-10-21",
  "sourceIndex": "https://ordr.kr/character",
  "disclaimer": "도감 등급별 나열 순서를 내부 식별자로 변환했다. gameRawCode와 평타 스펙은 아직 검증되지 않았으므로 null이다. roleTags는 도감의 요약 분류이며 전투 스킬 전체를 나타내지 않는다. damageSchoolHints는 역할 태그에서만 도출한 분류로, 개별 스킬 피해 유형이나 워크래프트 공격 타입을 확정하지 않는다.",
  "expectedTotal": 271,
  "entries": [
    {
      "id": "C-01",
      "grade": "흔함",
      "gradeOrder": 1,
      "name": "루피",
      "roleTags": [],
      "roleTagsStatus": "not-collected",
      "detailUrl": null,
      "gameRawCode": null,
      "attackPower": null,
      "attackIntervalSeconds": null,
      "attackRange": null,
      "skillSpecsStatus": "not-collected",
      "damageSchoolHints": [],
      "damageSchoolHintsStatus": "unknown"
    },
    {
      "id": "C-02",
      "grade": "흔함",
      "gradeOrder": 2,
      "name": "조로",
      "roleTags": [],
      "roleTagsStatus": "not-collected",
      "detailUrl": null,
      "gameRawCode": null,
      "attackPower": null,
      "attackIntervalSeconds": null,
      "attackRange": null,
      "skillSpecsStatus": "not-collected",
      "damageSchoolHints": [],
      "damageSchoolHintsStatus": "unknown"
    },
    {
      "id": "C-03",
      "grade": "흔함",
      "gradeOrder": 3,
      "name": "나미",
      "roleTags": [],
      "roleTagsStatus": "not-collected",
      "detailUrl": null,
      "gameRawCode": null,
      "attackPower": null,
      "attackIntervalSeconds": null,
      "attackRange": null,
      "skillSpecsStatus": "not-collected",
      "damageSchoolHints": [],
      "damageSchoolHintsStatus": "unknown"
    },
    {
      "id": "C-04",
      "grade": "흔함",
      "gradeOrder": 4,
      "name": "우솝",
      "roleTags": [],
      "roleTagsStatus": "not-collected",
      "detailUrl": null,
      "gameRawCode": null,
      "attackPower": null,
      "attackIntervalSeconds": null,
      "attackRange": null,
      "skillSpecsStatus": "not-collected",
      "damageSchoolHints": [],
      "damageSchoolHintsStatus": "unknown"
    },
    {
      "id": "C-05",
      "grade": "흔함",
      "gradeOrder": 5,
      "name": "상디",
      "roleTags": [],
      "roleTagsStatus": "not-collected",
      "detailUrl": null,
      "gameRawCode": null,
      "attackPower": null,
      "attackIntervalSeconds": null,
      "attackRange": null,
      "skillSpecsStatus": "not-collected",
      "damageSchoolHints": [],
      "damageSchoolHintsStatus": "unknown"
    },
    {
      "id": "C-06",
      "grade": "흔함",
      "gradeOrder": 6,
      "name": "쵸파",
      "roleTags": [],
      "roleTagsStatus": "not-collected",
      "detailUrl": null,
      "gameRawCode": null,
      "attackPower": null,
      "attackIntervalSeconds": null,
      "attackRange": null,
      "skillSpecsStatus": "not-collected",
      "damageSchoolHints": [],
      "damageSchoolHintsStatus": "unknown"
    },
    {
      "id": "C-07",
      "grade": "흔함",
      "gradeOrder": 7,
      "name": "버기",
      "roleTags": [],
      "roleTagsStatus": "not-collected",
      "detailUrl": null,
      "gameRawCode": null,
      "attackPower": null,
      "attackIntervalSeconds": null,
      "attackRange": null,
      "skillSpecsStatus": "not-collected",
      "damageSchoolHints": [],
      "damageSchoolHintsStatus": "unknown"
    },
    {
      "id": "C-08",
      "grade": "흔함",
      "gradeOrder": 8,
      "name": "총병",
      "roleTags": [],
      "roleTagsStatus": "not-collected",
      "detailUrl": null,
      "gameRawCode": null,
      "attackPower": null,
      "attackIntervalSeconds": null,
      "attackRange": null,
      "skillSpecsStatus": "not-collected",
      "damageSchoolHints": [],
      "damageSchoolHintsStatus": "unknown"
    },
    {
      "id": "C-09",
      "grade": "흔함",
      "gradeOrder": 9,
      "name": "칼병",
      "roleTags": [],
      "roleTagsStatus": "not-collected",
      "detailUrl": null,
      "gameRawCode": null,
      "attackPower": null,
      "attackIntervalSeconds": null,
      "attackRange": null,
      "skillSpecsStatus": "not-collected",
      "damageSchoolHints": [],
      "damageSchoolHintsStatus": "unknown"
    },
    {
      "id": "U-01",
      "grade": "안흔함",
      "gradeOrder": 1,
      "name": "로빈",
      "roleTags": [],
      "roleTagsStatus": "not-collected",
      "detailUrl": null,
      "gameRawCode": null,
      "attackPower": null,
      "attackIntervalSeconds": null,
      "attackRange": null,
      "skillSpecsStatus": "not-collected",
      "damageSchoolHints": [],
      "damageSchoolHintsStatus": "unknown"
    },
    {
      "id": "U-02",
      "grade": "안흔함",
      "gradeOrder": 2,
      "name": "베포",
      "roleTags": [],
      "roleTagsStatus": "not-collected",
      "detailUrl": null,
      "gameRawCode": null,
      "attackPower": null,
      "attackIntervalSeconds": null,
      "attackRange": null,
      "skillSpecsStatus": "not-collected",
      "damageSchoolHints": [],
      "damageSchoolHintsStatus": "unknown"
    },
    {
      "id": "U-03",
      "grade": "안흔함",
      "gradeOrder": 3,
      "name": "브룩",
      "roleTags": [],
      "roleTagsStatus": "not-collected",
      "detailUrl": null,
      "gameRawCode": null,
      "attackPower": null,
      "attackIntervalSeconds": null,
      "attackRange": null,
      "skillSpecsStatus": "not-collected",
      "damageSchoolHints": [],
      "damageSchoolHintsStatus": "unknown"
    },
    {
      "id": "U-04",
      "grade": "안흔함",
      "gradeOrder": 4,
      "name": "블루노",
      "roleTags": [],
      "roleTagsStatus": "not-collected",
      "detailUrl": null,
      "gameRawCode": null,
      "attackPower": null,
      "attackIntervalSeconds": null,
      "attackRange": null,
      "skillSpecsStatus": "not-collected",
      "damageSchoolHints": [],
      "damageSchoolHintsStatus": "unknown"
    },
    {
      "id": "U-05",
      "grade": "안흔함",
      "gradeOrder": 5,
      "name": "에이스",
      "roleTags": [],
      "roleTagsStatus": "not-collected",
      "detailUrl": null,
      "gameRawCode": null,
      "attackPower": null,
      "attackIntervalSeconds": null,
      "attackRange": null,
      "skillSpecsStatus": "not-collected",
      "damageSchoolHints": [],
      "damageSchoolHintsStatus": "unknown"
    },
    {
      "id": "U-06",
      "grade": "안흔함",
      "gradeOrder": 6,
      "name": "이나즈마",
      "roleTags": [],
      "roleTagsStatus": "not-collected",
      "detailUrl": null,
      "gameRawCode": null,
      "attackPower": null,
      "attackIntervalSeconds": null,
      "attackRange": null,
      "skillSpecsStatus": "not-collected",
      "damageSchoolHints": [],
      "damageSchoolHintsStatus": "unknown"
    },
    {
      "id": "U-07",
      "grade": "안흔함",
      "gradeOrder": 7,
      "name": "저격왕",
      "roleTags": [],
      "roleTagsStatus": "not-collected",
      "detailUrl": null,
      "gameRawCode": null,
      "attackPower": null,
      "attackIntervalSeconds": null,
      "attackRange": null,
      "skillSpecsStatus": "not-collected",
      "damageSchoolHints": [],
      "damageSchoolHintsStatus": "unknown"
    },
    {
      "id": "U-08",
      "grade": "안흔함",
      "gradeOrder": 8,
      "name": "쵸파 럼블볼",
      "roleTags": [],
      "roleTagsStatus": "not-collected",
      "detailUrl": null,
      "gameRawCode": null,
      "attackPower": null,
      "attackIntervalSeconds": null,
      "attackRange": null,
      "skillSpecsStatus": "not-collected",
      "damageSchoolHints": [],
      "damageSchoolHintsStatus": "unknown"
    },
    {
      "id": "U-09",
      "grade": "안흔함",
      "gradeOrder": 9,
      "name": "타시기",
      "roleTags": [],
      "roleTagsStatus": "not-collected",
      "detailUrl": null,
      "gameRawCode": null,
      "attackPower": null,
      "attackIntervalSeconds": null,
      "attackRange": null,
      "skillSpecsStatus": "not-collected",
      "damageSchoolHints": [],
      "damageSchoolHintsStatus": "unknown"
    },
    {
      "id": "U-10",
      "grade": "안흔함",
      "gradeOrder": 10,
      "name": "페로나",
      "roleTags": [],
      "roleTagsStatus": "not-collected",
      "detailUrl": null,
      "gameRawCode": null,
      "attackPower": null,
      "attackIntervalSeconds": null,
      "attackRange": null,
      "skillSpecsStatus": "not-collected",
      "damageSchoolHints": [],
      "damageSchoolHintsStatus": "unknown"
    },
    {
      "id": "U-11",
      "grade": "안흔함",
      "gradeOrder": 11,
      "name": "프랑키",
      "roleTags": [],
      "roleTagsStatus": "not-collected",
      "detailUrl": null,
      "gameRawCode": null,
      "attackPower": null,
      "attackIntervalSeconds": null,
      "attackRange": null,
      "skillSpecsStatus": "not-collected",
      "damageSchoolHints": [],
      "damageSchoolHintsStatus": "unknown"
    },
    {
      "id": "U-12",
      "grade": "안흔함",
      "gradeOrder": 12,
      "name": "하찌",
      "roleTags": [],
      "roleTagsStatus": "not-collected",
      "detailUrl": null,
      "gameRawCode": null,
      "attackPower": null,
      "attackIntervalSeconds": null,
      "attackRange": null,
      "skillSpecsStatus": "not-collected",
      "damageSchoolHints": [],
      "damageSchoolHintsStatus": "unknown"
    },
    {
      "id": "U-13",
      "grade": "안흔함",
      "gradeOrder": 13,
      "name": "후쿠로",
      "roleTags": [],
      "roleTagsStatus": "not-collected",
      "detailUrl": null,
      "gameRawCode": null,
      "attackPower": null,
      "attackIntervalSeconds": null,
      "attackRange": null,
      "skillSpecsStatus": "not-collected",
      "damageSchoolHints": [],
      "damageSchoolHintsStatus": "unknown"
    },
    {
      "id": "S-01",
      "grade": "특별함",
      "gradeOrder": 1,
      "name": "X-드레이크",
      "roleTags": [],
      "roleTagsStatus": "not-collected",
      "detailUrl": null,
      "gameRawCode": null,
      "attackPower": null,
      "attackIntervalSeconds": null,
      "attackRange": null,